{
  "type": "order.drop_cancelled",
  "order_id": "ord_fixture_drop_cancelled",
  "campaign_id": "campaign_fixture_partner",
  "cancelled_at": "2026-07-14T14:50:00+00:00",
  "drop_index": 2,
  "total_drops": 4,
  "ballpoint_billed": true,
  "ballpoint_billed_amount_tcents": 2527000,
  "reason": "user_cancel"
}
